plant_id,plant_name,country,year,co2_emissions_tons,co2_captured_tons,energy_consumption_kwh,renewable_energy_percentage,revenue_usd,expenses_usd,biodiversity_impact_score,ecosystem_impact_area_ha,species_impacted,reforestation_area_ha,compliance_score,audit_count,women_in_leadership_percentage,investment_social_programs_usd,risk_category,risk_description,mitigation_plan,future_emission_projection_tons,paris_agreement_alignment_score
d354c0d3,"Rivera, Martinez and Russell",Turkmenistan,2023,2712.6,237.71,4265963.98,67.97,27052720.41,9514665.11,4.85,45.82,12,49.59,81.31,1,30.18,279856.47,High,Treat quite yet institution three history chance.,Perform thank artist hold suddenly machine.,1315.99,97.02
e243de97,"Guzman, Smith and Hall",Sweden,2018,2871.05,327.09,1731733.27,52.53,35889245.74,13857329.67,4.7,29.56,44,68.82,94.78,5,29.2,25727.18,Medium,Eight case part too degree skin hold.,Direction compare worry modern civil.,3317.32,3.05
dd47bb88,Matthews PLC,Somalia,2017,4664.07,178.63,488272.81,56.53,2859692.87,15033940.46,3.41,64.4,34,66.94,80.66,2,26.97,215708.87,High,Become source six any take agent.,Group old soon part drive.,3277.77,5.57
766e84fd,Mann LLC,Somalia,2019,1770.59,723.35,3988233.03,88.74,24252820.09,17057438.75,8.64,44.08,23,49.07,91.96,2,24.86,127632.76,Medium,Face course race prepare unit.,Let window great line ground moment.,1738.76,28.28
579be2c1,Patterson-Larsen,Jamaica,2019,3586.09,299.5,1304368.4,71.57,47462040.23,11534287.98,2.08,70.5,2,59.21,70.73,2,37.06,457210.5,Low,Air create say soon.,Focus above leave book.,3832.29,84.55
08994268,Smith-Cherry,Thailand,2022,4161.88,330.55,447552.07,62.2,43170779.66,4950473.84,4.41,69.71,45,0.53,97.52,1,31.56,352093.64,Low,Resource drive boy fish play knowledge themselves.,Attack any economy next argue.,2954.15,18.01
a6467872,Wang-Cole,Holy See (Vatican City State),2020,4231.51,354.2,3092958.6,70.96,41502991.59,13670369.96,9.0,11.16,3,86.65,99.02,2,48.26,187439.38,High,Kid computer party keep star street cost.,Business read war cause opportunity.,2083.47,13.42
a4054773,Scott Group,Cote d'Ivoire,2019,4895.26,348.45,4872973.88,90.69,6711923.29,2370925.49,9.06,72.56,35,39.7,81.81,4,33.67,54855.77,Medium,True glass answer partner region any maybe.,Travel Congress thought kitchen future significant agent sign.,1417.17,3.93
124e63fb,Sanchez and Sons,Uruguay,2020,4604.23,223.53,4022535.3,51.42,5040390.69,18261691.25,2.18,63.11,39,68.46,95.62,1,13.51,433685.78,High,Education cover customer arrive hundred care student.,Bag her significant trip require employee.,939.52,19.6
c1ea2e6d,Patrick-Johnson,Finland,2022,1191.8,835.71,965640.85,37.76,33585974.16,6407518.79,6.79,9.99,22,5.16,86.38,4,47.6,454773.29,Medium,Far region subject tough site wonder science system.,Life common until continue.,577.18,61.91
10991694,Shields Ltd,Samoa,2021,2800.73,865.39,4631088.31,89.32,47389652.35,5808025.46,8.77,93.21,11,34.44,90.99,4,43.32,197792.71,Low,Water nearly still real so toward bank now.,Leave fly boy around forget one little.,1001.47,12.5
64c55d71,"Marshall, Taylor and Young",Honduras,2021,3293.2,330.04,4242666.61,33.48,11679205.91,6386906.75,5.98,4.78,42,67.12,89.51,4,43.58,400558.66,Low,Natural series good house before reflect sure.,Find since interest room care bad next lead.,878.59,66.88
742a5d7a,Watkins Group,Papua New Guinea,2023,3979.14,844.93,1573983.54,64.21,38643620.2,1913330.97,3.45,90.94,40,88.98,89.58,5,46.01,498487.22,Medium,Police sing someone provide story federal attack.,Fund hour respond product major we.,2273.26,6.04
5aa814be,Smith-Smith,Aruba,2018,1452.6,406.91,480888.13,49.33,10041353.72,11275755.44,1.44,2.93,22,24.77,76.76,4,26.32,88902.06,Medium,Scene actually amount training.,Draw between too call bill perform.,3176.4,94.39
6c68d738,Bruce and Sons,Andorra,2015,3510.42,961.54,2578433.28,35.59,8159115.01,18318842.38,7.84,59.97,38,12.24,82.42,3,23.98,484274.33,Low,Test present career myself argue speak.,Today yourself including.,1137.01,25.57
91d071f4,"Garner, Wilkins and Clarke",Andorra,2022,2150.52,999.71,2059598.47,77.42,27706837.81,11045207.38,8.39,62.08,44,16.03,82.52,4,41.9,61086.19,Low,Movement partner born relationship technology.,Various word true or list environmental scientist.,4702.25,72.79
810878d3,"Myers, Foster and Jackson",Japan,2018,2635.0,606.15,2672453.01,10.19,30322992.09,6706280.58,7.35,80.35,1,67.57,81.83,2,46.37,42420.76,High,Call every option worry improve learn full.,All evidence oil school economic.,1660.18,73.49
8d8eb9ef,Stewart-Conner,Chad,2017,602.85,208.5,2296787.2,30.08,12963060.42,7939220.87,7.86,19.81,22,1.86,96.36,2,19.88,444202.36,High,Learn relationship behavior official.,Across seek quickly blue.,591.79,39.96
44d005e6,Franklin Inc,Macedonia,2016,2750.52,724.03,377799.72,26.44,22025892.17,3914447.23,9.08,36.92,45,35.98,86.23,5,21.02,424145.06,High,Price many wife live follow.,Drug sister season fall television position decision.,3782.39,27.11
d48fa503,James and Sons,Micronesia,2019,4050.87,850.63,269010.63,79.59,14749535.76,2310678.27,5.92,80.1,16,0.25,81.91,5,45.11,374749.21,High,Tv talk employee economy movie blood.,Democrat reality bar simple.,4541.63,18.74
ea1b9b2c,Cole-Hudson,Rwanda,2019,2906.68,633.64,608326.14,36.07,23024092.41,19482972.97,2.84,93.41,25,87.86,94.3,1,46.0,172549.43,Medium,Meeting personal join move fill understand.,Serious what policy simply.,3830.61,74.09
db2a96fe,"Goodwin, Miller and Huffman",British Virgin Islands,2015,673.33,109.2,3287595.83,62.41,46322067.37,13799340.45,8.55,4.64,31,33.26,94.94,4,32.35,452223.05,High,Government task not she white fire apply.,Born feel line ok.,2091.99,85.21
b579e840,"Hall, May and Kelly",Albania,2019,3475.48,889.22,1597375.02,49.57,10621707.97,4917307.13,5.09,55.64,43,12.72,78.21,3,22.19,444909.85,Low,Human short either baby when anyone partner.,Significant just economic forget eat race born.,4434.32,76.34
5d3ccb39,Willis-Turner,Cyprus,2017,1911.8,600.3,1082690.97,41.03,1237532.9,14000339.69,6.41,15.31,23,28.59,94.24,1,21.4,140427.86,Medium,Customer race far military certain about bad.,Race write pretty real every partner.,3833.31,19.42
0378e7a3,"Jordan, Valencia and Fowler",Tanzania,2023,1387.65,815.76,4240962.12,30.44,17877318.5,4371273.02,2.79,91.56,0,70.57,91.24,5,40.79,96822.28,High,This the man nation relate southern.,Art others later dark rest.,3209.37,64.37
3aabf2f0,Daniels Ltd,Taiwan,2016,3744.92,72.21,3109673.38,30.21,4133435.79,11700051.17,6.49,41.92,43,54.02,79.28,4,15.52,82561.63,Medium,Approach pick east clearly institution with.,Them around rock science.,1300.68,47.13
926b041c,Gordon-Ross,Senegal,2018,3633.01,367.17,3022803.59,88.53,1915681.7,19002725.4,9.07,45.09,50,16.94,70.35,4,16.1,243729.21,Medium,Must exist return shoulder order discussion yes.,Institution onto four major us.,1571.06,71.9
b74f58ca,Lynch-Carlson,France,2019,2124.68,760.1,3906997.46,45.85,17249796.18,8774123.89,3.53,3.92,10,7.47,90.61,3,27.47,92869.14,Medium,Shoulder meeting thought feel.,Project like yes notice pretty.,2826.97,36.55
4d58b1fc,"Chavez, Edwards and Erickson",Albania,2023,3283.34,399.6,4309644.0,25.04,39649029.77,1256327.53,4.83,89.96,40,91.44,84.65,3,45.65,340483.01,High,Suddenly long later window trial move.,Century perform yeah citizen people my phone.,1400.3,61.73
8866aa69,Cunningham-Atkins,Saint Lucia,2020,707.52,373.42,1125678.71,53.34,5275720.61,17433967.32,7.69,74.13,8,58.76,87.44,5,45.58,71976.5,Low,Community assume improve also.,Area suggest question here wear suffer trouble.,3323.83,90.69
bbee2dae,Gomez-Pace,Jamaica,2023,576.1,503.29,3268562.25,80.12,33569860.92,6908993.55,1.41,88.58,28,21.57,82.02,2,30.39,255003.91,Medium,Town try chair project interview hear.,Become green method world federal.,4282.19,12.45
8e2876e5,Baxter PLC,Serbia,2020,884.77,670.91,2261713.22,74.37,20833947.87,8242414.02,5.12,84.86,37,25.39,99.52,5,23.75,227906.54,Low,Talk city assume imagine all brother.,Team total body training trip project.,3466.01,92.17
5453fbd1,"Harris, Reeves and Rojas",Isle of Man,2021,2166.19,667.86,1186152.4,64.76,36074157.87,4743000.9,7.67,3.26,7,15.99,91.28,5,27.87,252531.35,Medium,Effort fly population analysis.,Note family president society leave boy owner.,1544.78,64.54
87fdef0e,Chan and Sons,South Africa,2023,810.33,626.58,389579.4,18.26,36793927.05,16693386.31,6.06,36.29,40,75.24,85.46,5,40.01,130014.48,Medium,Skill player anything analysis letter goal.,Tonight just long protect seek.,2156.4,10.98
681958ad,"Anderson, Mitchell and Williams",Australia,2016,2862.73,419.59,112487.97,11.29,36808866.42,15022325.46,3.94,5.26,42,67.57,89.42,2,31.95,384436.34,Low,Report majority president.,Spring music usually southern possible.,3931.49,16.57
cacc0ff7,Miller Inc,Russian Federation,2021,1310.78,999.59,909481.31,14.13,13428129.46,18670897.68,3.59,12.23,21,90.59,89.59,2,37.47,495131.27,High,Image window similar people.,Forward form policy beat.,718.32,65.97
9c6c77b4,"Jackson, Baird and Wright",Bahamas,2022,2663.24,339.49,4767230.81,48.25,13747549.75,14376293.32,2.03,76.53,22,20.22,72.28,3,39.98,231974.56,Low,Each community social most game tree computer.,Born arrive reason your anyone high.,804.37,41.79
e14e0e38,"Austin, Gray and Alvarez",San Marino,2016,725.73,346.58,2297001.77,90.33,3577325.26,15332781.37,5.3,66.08,41,44.28,83.91,2,20.88,177174.18,High,Certain who condition.,Interview seven available election their from see second.,626.13,95.4
0d7a2b9b,"Myers, Camacho and Dougherty",Bolivia,2019,2826.63,980.55,704260.62,32.51,26171355.38,15209057.14,4.46,25.16,44,38.26,76.62,4,24.31,224681.93,High,Ago determine small beyond worker.,Board treat avoid director.,2461.13,92.26
ddd2e1a3,Jones-Michael,Palestinian Territory,2020,2043.6,620.39,4758749.17,20.33,19650037.41,16940491.28,4.6,65.64,32,52.6,87.84,1,43.9,229432.99,Medium,Purpose help east yard pressure.,Magazine large sure somebody.,4711.48,49.52
64822d28,Scott-Allison,Svalbard & Jan Mayen Islands,2018,2321.89,599.05,763077.37,80.71,2495772.87,13972457.77,2.75,93.09,34,65.8,81.19,3,14.11,294876.07,Low,Than seek off few.,Consumer commercial between his from son success.,1914.28,97.81
c1dc929e,Young LLC,Dominican Republic,2018,1364.61,692.38,3578743.92,25.21,40670482.74,653857.38,3.54,78.54,48,11.18,78.35,1,12.89,493934.93,Medium,Possible act show center economy local.,Into so let citizen follow left science.,4572.5,71.02
3383e194,Myers PLC,Nauru,2020,1259.74,307.37,2994298.2,35.32,10075346.57,16508825.03,4.51,26.54,18,31.03,87.56,2,36.62,71672.35,High,Person difference continue up nor expert American.,Point news sense soon room.,4729.41,34.31
db910fb5,"Woodward, Ramirez and Wilson",Singapore,2022,2436.67,511.38,3882392.36,71.38,14767702.8,12022969.96,7.75,59.18,0,71.0,99.38,2,45.81,33342.01,Medium,Production practice big rich case.,Media Republican entire if not sell.,2158.92,43.18
7a84a81b,"Flores, Christian and Wolfe",Iran,2018,644.34,126.7,2494817.84,80.92,12725267.05,2897424.46,3.81,84.8,10,93.15,71.66,4,28.3,471456.43,High,Magazine will space else.,Station but same start reveal resource.,2565.06,60.03
868cd252,Allison-Taylor,Paraguay,2021,1915.44,755.91,4859357.76,12.53,33130893.43,7645963.93,2.84,87.39,39,17.01,85.38,3,38.83,43606.35,Low,Never project pretty always sea.,Same try color work.,3208.34,88.85
cb717f43,Lee LLC,Lesotho,2017,1923.14,369.99,4351948.32,68.07,44902228.9,11128778.69,2.36,32.29,2,55.88,82.0,4,16.47,185370.24,High,Family we else fast nearly dinner.,Face care able word policy employee.,487.87,21.29
f6d78008,"Espinoza, Smith and Mccarthy",Bulgaria,2020,4078.04,162.84,564717.9,53.31,1856801.13,17007216.31,8.22,52.22,11,47.07,84.29,1,41.22,231129.49,High,Media wrong manage agreement magazine scientist state.,Fast management list yourself by voice.,471.5,70.9
52945f38,Mahoney-Thomas,Uganda,2021,3662.81,684.73,1827792.78,75.51,13752312.25,12221501.51,9.58,81.13,46,29.05,94.49,2,20.33,44870.98,Medium,Evening study state analysis.,Whole exist state dark.,1530.91,62.47
58dc5ce3,"Higgins, Young and Graham",Guam,2019,3564.76,361.11,2499010.29,48.66,23278671.45,16242315.27,8.63,5.83,21,75.35,97.45,2,27.0,413588.38,Medium,Throw those current goal event a spend.,Capital your surface country threat.,1431.57,81.72
d074f7de,Briggs LLC,Micronesia,2020,3249.65,99.41,544763.54,78.42,31713556.79,6745860.79,2.13,68.72,7,27.52,76.2,3,10.17,315333.83,Low,Camera energy improve wife rock live moment design.,Near quickly newspaper attorney buy about eye before.,4596.61,84.43
83e08092,"Hanson, King and Trujillo",Malaysia,2021,2166.51,421.15,1614970.43,55.75,3456178.31,15786401.46,2.35,23.76,17,83.46,72.56,5,24.01,306964.58,High,Sell player may authority former participant ball.,Most run hour action important author.,1965.8,29.6
4c8bcdcd,"Stewart, Powell and Anderson",Indonesia,2021,3813.81,122.16,133753.89,49.66,6296427.34,2553545.06,9.79,11.81,46,77.28,81.59,3,38.28,446458.54,Low,Course manager shoulder happen why.,Certain social admit without doctor.,2749.1,25.72
ded8d833,Simmons LLC,Cook Islands,2020,3936.41,649.99,2276657.35,27.25,48341590.37,16754080.03,4.47,79.71,43,10.84,93.86,1,45.26,358166.28,Medium,Set reduce discuss mother.,Government similar prove.,2552.38,10.46
b0d57d05,Horton-Hill,United States Minor Outlying Islands,2022,695.46,804.47,752053.1,28.16,38574743.22,4567959.51,9.95,83.39,7,62.92,72.04,2,34.5,312880.75,High,Practice town year shoulder parent.,Who color realize high often enough training.,3523.23,14.94
256174ca,Garcia and Sons,Slovenia,2017,890.65,773.73,4022049.56,83.26,40269539.77,7940549.7,3.93,23.25,40,18.04,78.71,5,20.07,307090.19,High,Major nearly I be especially side.,Nice hospital special professional.,3954.2,92.76
d96d2796,"Blake, Perry and Manning",Tokelau,2023,2701.04,606.35,4421929.71,58.74,24381162.77,8263052.3,1.23,56.51,13,78.44,84.6,3,28.99,468483.8,High,Society foreign sell often yes those.,Base unit similar minute source arrive information.,2908.78,73.88
b87eeeba,"Nelson, Ramirez and Simmons",Afghanistan,2018,2718.48,303.98,3580054.93,80.76,40836527.32,5500712.65,6.28,91.67,23,98.2,97.75,5,29.55,257333.36,High,Fund day clear main sense prepare accept.,Know free fear discuss.,3183.02,69.09
f73fb4cd,"Hunt, Martin and Martin",Vietnam,2022,4691.17,261.06,2475513.15,23.3,48192716.85,9905605.31,2.96,8.9,14,30.63,72.44,3,45.32,98231.49,Low,Professor edge music work food play send.,Side start wind most successful.,3285.31,49.6
7cb00be4,Young Group,Saint Pierre and Miquelon,2023,4876.95,971.18,3434670.18,60.35,5107986.55,8065985.92,3.04,68.87,48,60.42,82.03,3,15.92,364617.36,High,Off over girl popular.,Situation wind this least be.,3115.2,55.52
cb191848,Daniels-Rivera,Norway,2016,4725.04,579.49,3746873.92,98.58,24224960.82,18479350.18,4.86,31.53,4,69.29,95.6,4,47.53,402734.74,Low,A world weight billion boy sound.,Probably them street general company set build.,3994.51,62.51
f0c8ca8a,Howard Group,Liechtenstein,2016,565.76,849.11,3495952.08,92.87,23269365.04,10302705.14,4.86,39.95,24,12.34,87.27,2,49.84,49377.82,Low,Attack dinner quickly should.,Matter point their history police what try.,1456.44,89.94
ee7239b6,"Rowe, Glenn and Bowen",Macedonia,2021,2976.07,674.64,3726381.42,72.12,16943447.62,1250398.67,6.53,20.66,39,27.57,94.3,5,17.34,215596.46,Low,Option two leave cup.,Best office school nearly smile front east.,3452.52,82.51
a19be46e,Savage-Gutierrez,Samoa,2021,2934.1,473.8,1969451.75,67.87,17702489.71,6301556.99,5.38,70.14,34,83.66,90.23,3,35.13,399074.01,Low,Capital edge determine.,Business fact right response.,4279.26,90.01
875a502b,"Jones, Clark and Taylor",Guatemala,2016,2147.59,475.22,3127145.4,15.78,49594940.93,13440915.07,4.7,32.97,37,87.22,77.42,1,39.57,80133.04,High,Gas anything write interesting.,Thank name pick point when.,3707.27,79.7
4ffa822d,Galvan Group,Georgia,2019,4848.59,389.64,972154.25,14.73,31242815.88,4685891.74,2.01,39.78,28,6.73,85.35,3,18.18,139104.48,Low,Southern check somebody must face.,Other method commercial ten training dinner firm.,806.47,35.05
4674dbee,"Hunter, Jones and Washington",Trinidad and Tobago,2019,2014.73,436.09,3702301.05,59.71,17931950.61,1709071.83,1.56,91.06,38,41.3,77.5,1,30.22,41187.1,Low,Turn decide structure tree bring white probably.,Director expert evidence available.,2427.49,11.08
184dedb7,Thompson and Sons,Central African Republic,2023,1658.46,119.36,1491850.62,60.63,8402463.98,17144044.63,4.51,68.72,34,33.29,70.27,2,34.99,142483.44,Medium,Southern station respond those many will.,Alone everyone also turn Democrat.,4449.86,71.35
9d0588d9,Smith-Preston,Luxembourg,2017,1042.33,949.06,3658203.97,35.44,22515400.73,3366734.3,9.85,94.07,47,25.08,81.98,3,10.69,116394.5,Low,Yes nice head image than month national six.,Improve stuff agent success.,913.8,26.53
9c8e2b9a,Callahan-Freeman,Namibia,2019,2097.4,122.71,1820898.76,91.6,42363984.97,11919884.84,4.74,43.81,39,90.24,92.24,5,30.54,71212.65,Medium,Blue want north which.,Notice direction sometimes service number.,407.52,58.2
112543bc,Scott PLC,France,2023,3530.63,825.0,785451.94,84.63,42725671.82,10681115.39,1.97,62.39,46,66.38,82.22,2,11.02,464633.87,Medium,Pick look although improve carry.,Truth some project wait rate least listen.,4649.63,8.13
f8c810c8,Calderon-Bishop,Mauritius,2018,1988.5,594.18,1100750.47,38.85,14086527.03,5504379.23,4.28,93.29,14,54.32,87.73,1,44.51,377902.57,High,Bed position show offer feeling move control.,Value look single maintain.,3303.77,84.23
9559a152,Russell Inc,Seychelles,2023,3398.79,648.09,3586528.95,40.06,15316830.88,14594476.03,6.19,56.12,40,2.58,95.77,3,23.66,31941.53,Low,Spend hotel those group race.,Side difficult inside specific moment.,1736.05,47.63
32b040c4,Richardson-Davis,Niue,2020,1494.21,825.23,4688529.96,10.72,37605684.79,4929204.52,7.96,99.8,2,32.8,85.54,4,34.04,268028.06,Medium,Kind dark whose benefit.,Argue place trial garden charge.,1123.25,20.92
c0252ad8,"Martinez, Webster and Smith",Bouvet Island (Bouvetoya),2023,4718.71,752.53,338280.49,33.16,9403496.2,15499832.4,5.36,96.86,0,98.7,96.11,1,25.91,277327.84,Low,Picture try herself still head tonight evening chair.,Image finish use suggest name.,4176.42,83.29
8f2f2ae5,Bishop-Manning,Albania,2018,3894.01,191.29,4147497.67,68.47,25229857.81,4309487.56,6.12,33.88,33,10.39,92.97,2,26.53,247523.64,High,Method least recent clear nation.,Research small everyone and early ready.,1594.17,29.35
8caab4fe,Wood-Ortiz,Sierra Leone,2018,4698.22,72.9,4853966.53,92.59,2490867.23,5649733.66,4.82,93.28,41,29.42,78.91,1,18.25,18094.73,Medium,Human quickly floor after indicate listen soon.,Seek similar here.,2636.61,17.02
0d16a83a,Smith LLC,Trinidad and Tobago,2017,3176.1,363.53,1964120.05,17.97,34747166.81,4583377.33,5.15,69.42,50,7.7,97.25,4,28.71,263610.06,High,Hotel up beyond wall serve myself finish east.,Party left recent measure south law.,4145.56,56.89
5537edfa,Chen-Parker,Iraq,2021,1234.64,745.8,4693082.74,42.07,2327200.11,18804980.82,5.25,88.58,13,46.5,97.83,3,22.14,188154.81,Low,However country lawyer card situation agreement view.,Increase pay sell support season rather relate.,2776.27,63.81
fd071165,Nguyen Ltd,Togo,2022,4130.81,432.19,1821143.24,92.16,22859073.45,10882312.24,6.32,73.09,46,18.43,73.33,4,36.5,212490.41,Low,Question fish at head hear.,Quite American tell guess entire deep subject.,2735.11,54.98
059b350f,Watkins and Sons,Western Sahara,2016,1517.74,544.41,4314417.43,20.34,47704479.24,7958449.66,5.02,29.3,5,45.18,77.84,4,45.58,164824.44,Medium,Part often now open.,Drop believe if official wind trade.,4050.12,90.92
7f4341f7,"Gilbert, Alvarez and Velasquez",Fiji,2016,2663.92,735.18,1746780.69,21.48,14050375.14,2212319.93,4.65,82.95,5,33.48,83.95,4,10.41,328682.76,High,Arm entire story order.,Smile doctor series cost say.,3647.17,78.5
1f941f5f,Lucas-Woods,Guernsey,2018,1086.51,774.2,162462.75,24.01,27762382.75,4100857.69,1.47,42.97,42,21.61,94.77,1,49.57,113661.19,Low,Project statement free age security.,Throw gas white wide account paper.,4669.8,27.99
c03c07e2,Graham-Hawkins,Uganda,2019,4907.76,112.45,4654461.75,24.57,6209947.54,14674411.35,1.41,72.2,42,76.68,90.02,5,23.95,189456.58,Low,Bank call never thing compare life.,Teach science although in quality indeed.,4127.45,76.93
665bc885,Hernandez-Davies,United States of America,2023,1623.61,967.86,3276175.55,63.96,44033002.65,7726845.56,7.88,30.65,40,73.71,96.09,4,17.85,130585.55,Low,Realize clear arrive any reach.,Statement medical despite thought this you small husband.,3033.76,44.43
fa5262a9,"Young, Wang and Lang",Martinique,2017,2070.75,421.06,2259465.94,97.53,9245510.17,15840586.22,6.86,23.64,3,72.96,88.46,2,29.04,272717.89,Medium,Sport summer mean least home political form door.,Think glass professional best.,2681.73,66.82
e8cb94b7,Reese-Wright,Guinea-Bissau,2019,2478.0,964.07,3609742.2,66.85,13792901.49,3261179.63,9.01,46.54,47,30.44,74.93,2,12.98,196381.72,Medium,Become case ball pretty yeah spring.,Through current series finally after speech.,4651.21,23.64
a93d35ca,Mosley PLC,Luxembourg,2023,3945.39,754.08,1697846.11,39.42,5172647.3,12446327.33,5.92,16.75,43,12.86,70.83,2,27.21,492674.02,High,May close hard federal.,To himself over ever modern government notice.,2881.15,17.36
bb31cfef,"Jones, Barrett and Ewing",Svalbard & Jan Mayen Islands,2022,1953.53,675.27,3010059.88,18.98,25124747.49,9634996.68,7.35,79.32,38,29.22,94.0,1,41.56,469764.78,High,See last challenge law a important position.,Decide voice summer.,2545.06,33.56
bbbd7379,Barron PLC,Estonia,2020,3737.23,139.53,2645320.6,54.79,44033424.36,13468432.13,8.64,98.09,8,2.98,82.03,5,21.09,149330.32,High,Food also individual personal nearly model impact.,Full role training call eight growth process.,1437.35,46.96
50c38797,Herrera PLC,Bangladesh,2019,1816.6,779.27,4109118.0,35.92,26833665.31,2946735.37,6.71,89.04,0,36.43,97.3,5,35.66,123590.78,Medium,Treat off article tend participant whole.,Energy public hospital raise so cut operation physical.,4643.8,77.91
a223014b,Nelson PLC,Armenia,2020,1789.25,900.15,1157669.7,52.05,7363588.92,7665690.49,4.1,26.06,43,64.38,82.86,5,28.13,33063.83,Medium,Policy piece green particular.,Theory hard time give.,3312.29,24.08
478b2dfa,Jackson-Watson,United States of America,2021,2019.17,658.82,3316866.97,90.83,33986360.13,6812121.25,1.15,97.63,25,34.5,72.21,1,25.99,181148.36,Medium,Official offer owner democratic develop keep.,Western or art everyone Democrat occur.,757.14,87.07
a509c022,Cameron-Ayala,Cook Islands,2015,2826.36,291.64,1425489.6,27.34,47166819.02,18307431.08,2.7,30.58,40,46.34,76.3,2,49.93,95423.59,High,Participant nearly sometimes baby mouth theory arrive.,Entire chair station control future hour.,2128.3,98.88
dda93e66,Pierce-Wright,Yemen,2020,709.86,89.68,2610539.27,95.28,14372412.88,19137472.08,7.1,30.76,16,29.4,94.8,1,26.21,71487.4,Medium,City next serious he maybe interesting health herself.,Include home later start.,2574.79,40.14
8cc14112,Lutz PLC,Albania,2022,2727.15,481.87,2029757.28,92.1,1395881.59,4318944.55,9.37,59.27,9,81.01,99.57,5,18.72,383738.52,Low,Drug education short staff.,Certain heart easy approach.,3247.27,73.17
150af9f6,"Smith, Moore and Ross",Saint Martin,2017,2834.8,493.31,3059699.67,83.58,34322610.97,13314608.31,2.97,63.95,40,17.06,86.61,2,41.54,275614.37,High,Health player water all.,North part before sort.,4744.98,27.48
4d2366e9,Sloan-Preston,Armenia,2016,4692.56,119.36,3460536.1,99.08,13454705.72,16540039.59,7.58,77.9,49,19.15,93.8,2,40.55,232254.61,Low,Know letter five stuff blue example.,Everyone wide soon physical.,1050.43,32.47
64dd6c49,"Douglas, Young and Weaver",Hong Kong,2018,639.23,689.25,4850056.31,68.78,28919991.94,5693365.12,5.72,63.34,41,43.35,70.51,3,38.28,57900.75,Low,Section serious identify laugh.,His owner few hospital.,1630.28,78.12
cc5540c8,"Gutierrez, Jones and Snow",Saint Lucia,2018,1724.25,269.07,1515495.55,37.38,46152293.62,9224569.49,6.27,57.52,10,87.63,77.65,3,13.5,267911.89,Low,Happen miss her.,Trial current these expect step.,1297.72,50.09
18772542,Cooper-Carroll,Bhutan,2020,521.96,452.92,664851.74,50.98,14039379.66,3441754.1,4.99,37.49,38,29.54,88.27,5,32.8,242653.56,Low,Some store unit.,Line speak wish break for though.,740.99,80.87
55491d55,"Young, Cortez and Walters",South Georgia and the South Sandwich Islands,2021,1709.22,112.5,1393167.89,22.23,46136210.71,4116926.79,9.33,99.83,47,65.47,88.14,5,31.08,214616.04,Medium,Message growth develop happen financial early travel he.,Chair real deal hope why computer.,1924.16,98.4
a5f64f72,Miller PLC,Barbados,2023,3552.26,685.87,598353.16,48.28,8261581.39,17415248.35,1.11,25.8,18,81.18,92.63,3,11.63,265419.51,Low,Notice arm force rule from for compare.,Call purpose much positive.,1404.6,16.61
32113f3e,Mcknight-Santiago,Iceland,2017,3050.71,63.69,3123937.94,51.3,37196973.44,2495111.16,9.09,27.38,38,55.53,78.34,5,40.09,290736.0,High,Act book history.,Wear team along avoid.,2397.77,29.13
017091fc,"Ramirez, Stanley and Richard",Belize,2022,3220.11,288.25,4543035.74,58.87,27928956.77,19373175.34,1.37,75.65,12,15.72,81.07,3,49.28,119858.45,High,Wall difficult check usually worry.,Raise involve even able reason late.,1283.85,11.78
8b95bbf3,Sullivan-Farley,Cayman Islands,2022,1940.02,908.85,4679976.11,34.68,23083577.49,14552115.45,9.45,76.25,2,59.25,82.72,1,14.8,255866.48,Low,Real ago space.,Take whether water will into true prepare.,4165.28,54.06
187fbdb2,"Cooper, Hurley and Peck",Togo,2023,4102.44,772.0,2312662.69,53.96,6441774.08,15663345.56,8.51,20.19,29,90.9,89.8,5,11.71,113675.6,Medium,Production measure option and it between.,North offer effect include learn anyone.,1104.66,40.2
82f79dac,"Bond, Jensen and Ramos",Qatar,2023,4628.0,940.78,1235810.53,42.65,1560590.98,4260637.69,8.29,83.74,16,43.39,97.52,1,34.86,440112.45,Medium,Clearly too see professor.,Production high pass north beat decision claim.,4244.41,56.11
c3fb785a,Fields PLC,Bermuda,2018,3289.14,273.12,2891383.19,65.45,35050946.07,11259934.18,1.57,91.44,5,26.85,94.69,2,39.1,91808.89,High,Leave remember window.,Bag fund seek beyond lawyer leader environment.,1117.37,63.81
