plant_id,plant_name,country,year,co2_emissions_tons,co2_captured_tons,energy_consumption_kwh,renewable_energy_percentage,revenue_usd,expenses_usd,biodiversity_impact_score,ecosystem_impact_area_ha,species_impacted,reforestation_area_ha,compliance_score,audit_count,women_in_leadership_percentage,investment_social_programs_usd,risk_category,risk_description,mitigation_plan,future_emission_projection_tons,paris_agreement_alignment_score
1f2403ea,Lawrence-Long,Zimbabwe,2020,2877.68,818.49,1252438.36,23.27,3121347.16,17405567.93,7.19,28.71,34,87.78,76.8,1,14.62,109481.09,Medium,Soldier read song knowledge test nice success.,Result must carry those water.,3835.51,97.56
63acb596,Waters-Wilson,Guinea-Bissau,2022,4035.86,466.8,533234.07,77.5,6127114.44,11997353.68,1.57,20.36,31,13.65,96.79,1,32.88,74896.82,Low,Pressure night watch yourself than once loss.,Suddenly trial point dog.,4702.15,32.87
7027cd25,"Perez, Green and Fuller",Monaco,2023,542.92,360.81,1733422.31,82.2,10760314.62,17536575.66,3.44,9.33,2,26.71,92.42,4,40.95,160634.63,Medium,Science character character thus memory.,Shoulder decade respond one.,4662.41,72.79
df96b78b,Olson and Sons,Saint Lucia,2022,4508.72,511.95,2760227.12,78.66,7628590.36,5263668.77,2.69,81.33,26,92.02,97.66,2,18.55,462213.37,High,Actually we blue test like.,Pretty not page occur.,446.25,58.48
d7a605d1,Tapia-Fuller,Gambia,2021,733.58,736.98,1340732.5,31.97,38867443.0,6671668.4,1.33,41.46,29,67.57,92.82,5,37.02,200012.8,High,Sound anyone real scene individual treat.,Possible memory every government subject defense.,1672.88,9.18
5be5ae3f,Haney Inc,Belize,2022,3721.63,537.49,4896496.03,25.29,41312109.54,14428323.47,9.55,29.69,5,34.89,78.31,2,43.08,52319.93,High,Gas hundred town hair morning.,Network perhaps give member discover.,595.81,13.59
6d349d38,Hall and Sons,Micronesia,2016,3656.59,479.82,1187115.57,47.92,3954501.22,8300382.11,3.96,41.16,21,60.12,95.46,3,11.34,347160.83,High,Along nice within close real.,Truth writer pass operation hard drug tax.,4303.39,69.92
5322c07f,"Oliver, Caldwell and Thompson",American Samoa,2022,1657.36,309.93,584463.99,45.84,32238583.7,9257130.4,3.15,78.94,15,48.77,87.37,1,34.34,123832.43,Low,Sense state agent win.,Wrong organization her seven.,1142.98,51.52
5fe99d59,Miller-Shelton,Malawi,2019,3045.53,221.47,2408658.4,85.54,12642903.2,5797220.49,4.64,55.42,3,46.97,87.99,1,39.78,457981.45,Medium,Alone wide both thousand space detail.,Visit usually old believe each practice.,1543.92,34.99
87425052,"Douglas, Dean and James",Timor-Leste,2016,3882.63,872.25,2432888.13,36.91,34926968.94,11942874.08,2.27,29.09,46,65.61,71.11,4,10.59,279904.78,High,Agency where help might goal wait.,Senior shoulder wish campaign marriage ago whole take.,3406.6,29.98
53e8ed76,Collins Inc,Netherlands Antilles,2021,3095.78,385.96,1739663.03,71.08,25112578.46,15940758.9,9.59,92.33,0,35.92,83.67,1,23.41,142520.05,Medium,Ok consider cost window finally onto southern move.,Buy long write student interest camera.,802.92,44.36
f0c1c061,Hart-Snow,Wallis and Futuna,2019,4534.55,945.32,2514266.1,50.6,49522202.31,8934460.48,9.18,8.45,31,77.03,88.05,5,17.91,374786.38,Low,Price step go player.,Different dream assume agree.,761.01,29.83
eede3a3a,Mckay Inc,Dominican Republic,2023,3718.86,650.87,4462163.91,66.56,24755998.15,6094550.47,1.59,99.1,31,33.92,85.94,3,25.34,456436.49,Medium,Think sign series training.,Case memory history city cause.,4444.19,77.32
e799d795,Garcia PLC,Honduras,2016,4658.46,346.67,4558542.78,40.81,3581154.77,8114757.86,6.58,27.77,48,70.6,87.79,2,16.82,483675.9,Medium,Arrive art bring on every central.,Computer nice carry believe make reach adult.,3945.92,21.49
f4b00416,Hurley-Skinner,Kuwait,2022,3095.79,944.44,4729224.53,86.83,28535113.82,13902982.05,4.41,60.37,30,62.38,72.98,4,44.17,252422.35,Medium,On push water anything owner which senior.,Capital campaign current kitchen also son.,4715.21,64.1
1c458c6f,Bentley-Wolfe,Greece,2022,722.92,408.27,2155765.29,87.14,11855933.24,5510042.05,9.02,90.5,38,64.09,89.17,4,23.31,213557.73,High,Speech reach me challenge.,Price our join between.,1419.95,74.22
decfbbe3,Tate-Rowland,Saint Barthelemy,2021,4619.79,127.6,3995041.31,32.14,13070560.57,16197335.28,9.29,67.74,12,67.31,93.08,1,25.33,144732.01,High,Population worker hand possible policy.,Institution share city despite project herself ask last.,4280.54,65.4
fafbd834,Davis Ltd,Serbia,2020,3704.68,882.25,540204.58,96.38,21814232.5,12816157.26,3.41,69.59,34,20.55,75.96,4,40.57,73267.11,Medium,Alone state spend raise art.,Senior author help item southern physical.,3416.22,69.33
29ed7497,Russell Group,Montenegro,2021,4475.42,98.73,449071.81,60.46,41600387.75,2281919.51,3.43,87.0,26,25.5,94.6,5,19.78,446563.77,Low,Late article different kind media.,Half second reveal community gas gun.,2908.72,35.26
c1654718,King PLC,Belgium,2022,3886.62,386.24,2190290.6,34.72,28424089.85,4862558.46,4.03,6.1,30,95.36,75.04,2,30.53,421840.2,High,Less song I.,Stand memory view outside.,1781.02,2.15
85b38f96,Bradley-Monroe,South Africa,2021,1265.54,260.42,306043.56,55.85,2594512.23,7617157.99,3.58,13.14,18,84.65,97.46,1,18.72,74994.2,Low,Policy example a here.,Interest recently central any.,1944.06,83.43
65167630,Miller Ltd,Kazakhstan,2020,4738.45,249.91,4205620.22,98.89,47384852.79,6189538.47,1.51,97.06,16,51.4,84.69,4,18.05,77566.6,High,Player clearly recently sing leg value.,National former culture here deal black sister hour.,1932.44,18.91
5414e236,Lawson-Rubio,Kiribati,2018,1432.62,102.3,3686144.69,86.59,11049188.95,18797426.59,2.77,14.69,31,58.37,93.43,5,19.31,135576.67,Medium,Bit special drug late third past.,Yes of small drug say market team.,4444.82,59.76
3bc4d306,"Simpson, Vargas and Woods",Burundi,2022,4422.49,55.91,692671.78,73.16,18013440.45,2669330.21,6.49,62.94,20,68.75,70.48,5,21.89,140408.92,High,College image reach drug late.,Book course decide data.,1351.31,8.81
038a0959,Bailey-Washington,Saint Helena,2023,810.92,961.11,925038.37,69.24,48431628.03,5780023.5,8.3,96.92,47,99.99,85.27,3,15.88,330390.59,Medium,Including fact culture science offer social able.,Card security although hand later develop to several.,4091.18,72.1
498fa902,Adams PLC,New Zealand,2021,3458.21,515.27,1610001.98,16.53,12695988.94,18717618.21,4.63,75.92,35,13.38,76.28,3,17.36,53712.4,Medium,Human test law report work follow whose.,Key place can leader specific situation agreement development.,501.83,67.48
4a7e7018,"West, Morris and Howard",Moldova,2017,2245.86,846.77,4403584.36,65.92,31167571.07,6777730.6,3.96,19.97,48,45.06,98.02,1,43.36,184836.2,Low,Seek activity own stage huge father since.,Attorney floor kid quite item offer.,2679.4,21.07
1213271a,Dean and Sons,Northern Mariana Islands,2015,4314.63,679.65,4006317.27,61.41,16139686.39,3072187.32,3.66,68.56,47,12.67,82.34,5,18.56,487441.21,Low,School population message business allow bar position perform.,Example happy remember author where suffer.,3096.26,42.74
ef2629bc,"Curtis, Howard and Robertson",Tajikistan,2022,3246.12,231.24,2874386.88,36.54,22528730.5,3398632.75,9.56,17.43,5,58.13,73.39,2,19.86,201329.9,High,Off teacher last difficult wife build.,Teach feeling interest last.,1867.83,67.51
4d71f103,Alvarado LLC,Egypt,2016,1757.62,916.04,1294322.11,12.78,26595586.38,7996688.67,3.59,28.56,40,51.03,95.38,1,44.97,61309.73,Low,Explain open total impact also rest property.,Others vote spring within.,2655.63,3.9
698d6d9a,"Marks, Montgomery and Vega",Gabon,2022,4001.58,396.04,4186503.14,53.09,34969901.16,5932080.06,6.68,15.43,8,68.1,71.0,2,45.6,276267.08,Low,Tree lawyer ten.,Might budget risk.,779.9,44.76
f4e3c4b5,Richards-Green,Nauru,2022,4094.61,332.23,3761379.25,70.3,45357524.51,9500586.54,7.85,58.71,1,70.87,96.51,4,45.18,24853.25,Medium,Deep option even new believe television.,Short step ground issue.,1608.1,21.98
504116bc,Fry-Peters,Serbia,2023,4969.16,250.84,2991953.77,90.15,15959259.06,10808749.99,2.34,48.4,31,36.06,87.77,3,45.44,335362.06,Medium,Financial color week almost perform.,Administration environmental sound professional.,1555.58,33.83
a85bf843,"Lambert, Lewis and Carroll",Gibraltar,2023,566.4,512.35,1390381.16,51.09,28171863.34,16312208.49,8.57,36.21,1,72.0,86.7,4,39.15,326060.81,High,Case attack government few.,Pm side sing song four.,3961.58,2.12
17ea199b,Alvarado and Sons,Germany,2016,1970.89,987.38,1624568.45,79.88,15972295.73,10903521.21,7.29,89.79,15,78.12,98.77,5,18.8,12742.05,High,Second stay image from budget interview.,Anyone senior area suggest green decision.,2879.06,0.8
57bb3147,Holt LLC,Maldives,2017,1720.75,762.75,2050431.93,78.98,25852384.7,4639893.59,9.15,48.0,4,61.61,74.3,1,26.44,43149.23,Low,Draw back such city.,Result expect front idea choice southern factor eight.,4027.17,48.57
83d247c7,Neal Group,Trinidad and Tobago,2015,769.78,726.39,4111008.81,50.43,6643506.71,14105600.28,2.12,75.93,25,29.25,70.43,5,25.28,351671.87,Medium,Someone star class mean data.,After talk plan American with could require wrong.,1566.12,48.34
2db58c60,Hughes Group,Saint Helena,2017,590.25,492.62,2573641.32,50.49,16492919.0,13473568.88,3.73,33.97,30,81.32,92.01,5,37.85,343162.07,High,No throw use win research mouth event section.,Issue water evening short.,2149.07,97.72
cd43de25,"Walls, Holland and Quinn",Vanuatu,2018,4916.42,931.64,2146251.01,22.93,24350906.8,3841652.49,4.85,91.92,17,94.41,73.87,2,26.12,361036.5,High,Lead mother I oil report.,Amount national sign family politics goal.,936.45,49.48
f7b9e755,Larson Ltd,Saint Martin,2016,1506.55,777.51,2946229.72,69.07,23618304.53,7202353.91,3.59,33.79,39,45.43,97.87,1,46.87,99944.6,High,Heavy save example.,Administration oil better now during movement training.,3027.68,84.2
91c2782a,"Tran, Sampson and Foster",Poland,2023,773.51,789.34,230857.59,81.05,45410754.84,10552657.59,7.4,8.44,12,89.19,95.71,1,25.61,386957.99,High,Fact mean blood result wish.,Record trade discover deal head his.,693.28,28.55
c5feef85,Reyes and Sons,Korea,2022,3501.19,288.92,998430.86,87.16,49564377.51,10634684.54,7.15,83.9,8,30.06,71.43,4,23.92,175814.69,Medium,Particularly south field food student.,By town yeah hot we car.,2672.4,37.8
2c03d3a9,"Pena, Gonzales and Ochoa",Oman,2023,544.97,948.84,3020141.63,10.47,26846862.36,17122012.53,5.82,1.94,22,82.13,99.49,3,32.4,223879.28,Low,Nearly star than agent citizen name.,Lead often hope run its phone stop.,594.74,21.97
f58d7871,Simpson-Johnson,Saint Lucia,2016,2131.38,718.49,4701560.89,73.72,16292280.31,8880067.01,4.66,24.76,26,40.5,90.87,5,37.46,383030.25,High,None source letter word speech cup table.,Agent group much own.,4038.61,78.01
6022fcd5,Leach-Villarreal,Angola,2021,982.93,685.21,1969764.51,47.15,12113661.88,1983738.98,7.62,66.72,32,6.64,74.26,4,29.54,468603.04,High,Available end by cut.,Nothing hope direction hit.,2409.73,80.56
72f4ff0e,Jensen Group,New Caledonia,2015,3688.51,367.53,789809.6,72.74,16548365.16,11004327.57,8.15,60.89,18,19.78,75.01,1,10.59,58777.98,Low,Describe particular not high type minute wonder return.,Theory resource administration guess rise.,2217.13,31.58
0b87c72f,Duncan-Cox,Netherlands,2019,4493.6,108.84,1336711.03,28.83,47025487.84,8152218.89,8.03,11.95,47,26.28,80.99,5,40.6,319386.82,Low,Color people charge simply throw health American.,None eye force ever about store.,2833.82,52.04
9710b9bc,Johnson Inc,Gambia,2022,3661.54,541.31,557172.52,68.22,18123026.59,17127115.8,3.77,35.93,13,3.99,93.14,4,13.54,421128.35,Medium,One board perhaps shake run.,Piece party return explain stand.,2352.3,16.94
e8e3c8d0,"Rivera, Moore and Taylor",Spain,2022,3434.89,426.26,1065393.74,12.84,47602066.19,4459983.63,8.84,19.0,43,23.77,82.21,5,44.11,198512.9,Low,Mr hospital record work class.,Give ask prevent quickly almost knowledge senior.,2955.25,1.32
05dd432a,Nelson-Rhodes,Mauritania,2015,2641.07,81.6,1928062.19,71.93,40752029.58,5755118.07,4.25,85.27,6,24.75,85.36,1,35.34,237474.58,Low,Live anything letter call about.,Source exist understand.,2684.36,89.51
4eb1ceea,"Miller, Nguyen and Brown",Indonesia,2016,3216.13,439.98,1302890.06,13.17,32179768.83,6825675.33,9.65,17.06,29,0.52,78.08,3,28.12,25055.87,Medium,Key outside too even just dream eat instead.,Peace enough sort student fear.,1904.29,33.34
4357545e,Ramirez PLC,Western Sahara,2023,1679.31,274.43,1871743.55,37.21,42881053.38,1016057.84,6.13,3.01,42,95.08,90.16,3,35.45,80557.53,High,Natural plant bill get scientist.,Edge model art us government occur three.,1757.18,28.7
5e340f6f,Williamson-Duffy,Spain,2023,4399.45,113.41,3026744.66,21.64,21049741.87,7356277.91,1.38,92.31,28,69.19,79.71,3,36.77,404736.79,High,Human several fly painting system.,Suffer particularly wonder card.,4369.56,16.19
7ec1a06a,Perez-Weber,Morocco,2019,1061.87,80.22,1560115.3,79.55,7405664.11,6162543.44,4.76,92.84,6,34.15,81.51,1,38.38,33705.74,High,Side ground service kind.,Stay require billion grow.,4059.69,24.85
5a02ef3c,"Baxter, Krause and Walker",Malaysia,2016,1973.29,749.78,1225202.24,10.42,31451984.12,6665263.72,2.38,64.07,22,57.06,70.12,1,13.08,48876.5,High,Area audience possible game garden represent knowledge.,Drop resource remain gas spend her human.,4527.7,3.2
26f72f70,Lindsey-Lopez,Algeria,2019,3147.85,246.4,3970341.38,38.32,26538262.3,8610354.75,4.59,11.8,44,14.72,98.81,5,25.57,43966.97,Medium,Number better around man then.,Player investment newspaper far poor several.,2144.1,7.44
38f1d04d,Hall-Mccoy,Norway,2020,2832.88,686.24,2146729.57,31.42,4496364.06,10424417.19,1.21,29.79,1,8.59,83.24,1,19.79,373161.5,Low,Address husband party peace suggest.,Put where long their strategy.,3292.7,39.32
3ac9b771,Mcdaniel-Chan,Ghana,2023,2357.08,237.43,3145133.38,29.59,3495104.92,15232333.58,3.22,87.32,38,19.93,95.61,3,48.08,38778.58,High,Risk sell agreement structure.,City name economic bad reality sure.,2760.43,20.81
c9ebe750,Morales-Foster,Serbia,2018,2110.08,550.16,4232701.76,93.2,37402460.41,14647608.56,4.52,90.23,23,30.81,79.32,3,37.37,455085.46,Medium,Top quality various want.,Stop meeting air break operation.,4395.2,88.75
462c7a44,Kelly-Shepherd,Georgia,2022,2085.76,471.16,2471634.55,21.18,3675925.07,11166391.08,2.43,98.7,21,76.99,96.51,2,18.49,206195.69,Low,Employee democratic city start.,Term leave national throw.,1125.53,52.55
0f81d13d,Steele and Sons,Sao Tome and Principe,2015,817.15,292.12,1904713.39,55.38,11188321.42,12168312.99,6.11,12.64,32,49.06,89.81,2,39.64,88949.67,Low,More happen can quite need including.,Law that energy challenge reduce who.,2727.55,43.1
49d376e2,Thompson-Cherry,Denmark,2017,3035.82,556.39,2032494.48,68.0,2036614.21,16138484.89,5.17,81.83,10,15.69,73.08,2,30.83,88592.64,Low,Key offer radio.,System meet wish her mother peace.,3737.3,97.12
5c0db034,Ross LLC,Cote d'Ivoire,2015,1259.04,168.27,2211930.28,30.25,5279775.95,12391526.12,7.29,60.57,8,73.26,85.82,1,30.0,153623.17,High,Exist cultural such defense.,Cell keep research leader part.,2756.01,21.88
426b98f0,Mora LLC,Kazakhstan,2022,1323.25,703.52,2345102.15,74.46,49952176.63,11127938.87,2.35,60.53,19,0.18,98.72,4,42.42,386988.89,High,Expert method final.,A front nice myself.,3357.22,16.03
0c8253ce,Ward-Marshall,Benin,2019,685.93,973.17,2626510.48,32.5,16482806.47,18175369.55,5.84,27.2,28,5.7,80.91,1,43.02,53406.81,High,Rule against ago draw discuss.,Detail I raise do amount pattern.,4624.94,77.48
482a2625,Barnett-Gray,Australia,2021,2167.85,358.44,4417243.8,48.3,28341488.64,14150178.82,1.22,87.42,17,98.53,92.44,2,17.32,417526.8,Low,Study participant matter.,Conference land money claim candidate hold thing.,4614.25,26.11
2e033c25,"Fox, Perkins and Davis",Uganda,2023,4202.78,722.02,4725069.29,11.63,33919544.51,19534650.78,9.44,89.97,11,23.57,79.76,3,31.68,426219.09,High,Risk your heart.,Above consumer million.,4338.39,84.89
f205725e,Johnston Ltd,Gibraltar,2018,4403.04,440.11,3402668.04,46.19,9335273.5,5384991.16,7.3,82.67,0,46.67,75.8,5,31.1,26928.06,Low,Clearly direction write easy instead billion health.,Box five other today.,1632.26,37.39
3b53eb91,"Lee, Kerr and Bass",Nauru,2015,879.04,816.48,3255981.19,50.99,32914082.74,9444887.51,6.87,15.69,28,76.48,95.53,4,22.31,144215.62,Low,She fly marriage story nor.,System nation management trial ever.,1839.49,67.95
69942de3,Mendez-Johnson,Tunisia,2018,3917.98,448.95,1985395.52,33.4,42091267.61,6301883.22,8.89,29.78,22,64.21,76.54,3,14.62,396478.03,Medium,Practice so training spend history.,Green cold couple although phone.,2055.98,31.62
14dad2ae,"Moore, Bowen and Williams",Finland,2020,2225.56,522.37,2399336.18,70.24,20111286.32,19028356.85,5.37,70.64,37,3.87,86.87,3,47.88,422885.81,Medium,New argue behavior industry show indicate visit protect.,Cause year foot speech trial staff.,3793.51,5.96
90afad00,"Rowe, James and Smith",Burkina Faso,2018,623.9,403.14,4080762.19,18.63,45298649.99,16803237.92,3.44,58.54,38,55.77,85.51,5,12.05,208800.36,Low,Listen born identify big agent next.,Street nothing until throughout year.,3689.77,21.8
d2c9b732,Gregory-Harris,Samoa,2021,1355.84,700.13,3863155.09,26.1,27934303.92,7095535.45,5.1,71.51,21,13.18,86.27,1,19.45,109284.77,Medium,Let list science election the.,Apply station offer late computer three.,3199.45,10.83
3018ad4d,Stevens LLC,Dominican Republic,2023,3172.35,178.81,3654199.56,99.31,48264068.88,7742134.36,6.23,50.06,27,74.82,72.47,2,46.57,152520.26,Low,Everybody relate expert film.,Hot morning night.,1819.6,31.7
4d791bdb,"Bailey, Harper and Hunt",Micronesia,2021,4465.47,152.94,3472006.28,28.08,20632891.56,1973513.62,8.61,12.45,4,21.59,74.23,4,12.41,131826.52,Medium,Appear government reflect movie.,Already treatment politics scientist describe you.,4415.22,59.89
58cc1958,Oconnor-Lopez,Argentina,2020,4720.24,246.34,2147705.61,60.29,21121082.58,1166445.76,8.59,22.1,19,15.69,70.04,1,16.91,451365.01,Medium,Interesting consumer policy walk community natural recent unit.,Nature citizen treat left professor whole need arm.,2734.63,38.4
beed1f81,Garcia-Newton,Albania,2015,1603.58,355.0,3942728.25,89.52,25360605.71,3352357.29,8.28,68.06,45,1.33,84.97,4,21.12,161783.52,High,Decision task office budget son.,Mean figure arm subject.,1404.11,49.82
3772fb8e,Peters-Jones,Panama,2023,2775.41,694.64,3450620.1,67.53,25124159.68,11378982.66,2.6,45.85,31,26.39,77.62,3,31.59,375151.49,Low,His may night letter listen.,As not stand page.,3113.19,52.77
75823e36,Holt LLC,Niue,2016,1208.57,197.95,270267.53,83.06,23454077.55,3493145.24,5.58,81.19,25,64.7,73.62,5,40.83,251099.7,High,Sound usually indeed go character out.,Miss life prevent work.,2364.62,56.45
0b5cd6cd,King-Barnes,French Southern Territories,2015,2865.27,101.84,1518021.62,65.7,45171272.82,2117116.81,1.5,98.6,6,99.58,87.99,5,10.47,179454.84,Low,A why someone big world yard fire.,Development make each together.,3385.6,59.42
9aa2cc33,Carter-Small,Ireland,2019,1465.88,550.21,2706180.6,68.95,10015438.56,18356046.82,5.07,5.16,47,74.62,71.2,3,15.24,421789.33,High,Even party one manager allow speak.,Someone however smile instead bit plan improve recognize.,2594.77,7.98
1c241836,Soto-Barnett,Tanzania,2021,570.94,228.65,1636785.23,53.01,37368633.9,3580085.69,6.72,70.77,16,89.68,90.66,2,24.97,139597.98,Medium,Behind maintain condition share support matter artist.,Become husband form entire laugh develop.,4467.11,52.57
4239cc7c,Coleman-Thompson,Colombia,2015,1268.4,787.36,3484935.59,60.72,33095979.69,6354864.76,1.41,91.98,12,89.7,96.1,5,12.21,368873.61,Medium,Modern reality Mr dog but family.,Quickly memory consider another.,3569.49,59.55
a47ea082,Hampton-Franklin,Falkland Islands (Malvinas),2017,2244.26,461.67,1309170.92,66.56,28725054.31,13550007.21,5.81,52.24,9,2.42,99.57,4,28.09,156562.5,High,Deal time military yard.,Tough yard Democrat remain PM outside will.,3383.4,80.85
b87618b8,James-Cervantes,Bouvet Island (Bouvetoya),2020,4670.48,586.75,2704553.06,90.68,38957234.94,9691185.1,9.81,91.26,48,19.24,94.42,1,24.01,43671.72,High,Own behavior dark.,Board customer who nor notice carry.,494.54,19.64
42aa50e1,Smith Group,Madagascar,2022,730.75,580.3,3191802.11,67.8,43272474.93,10559378.12,2.42,40.62,35,38.41,83.92,3,37.09,338286.41,Medium,Teacher money war way ago cold contain heart.,Push executive word scientist.,1923.51,58.09
7268aa8b,Key Ltd,Bahamas,2018,1564.28,537.76,4588446.84,70.7,34270994.89,14876030.83,6.79,11.68,43,17.51,79.75,4,20.59,134095.04,Low,Occur image wish century measure almost.,Land must thank position.,3285.57,33.3
57bffacb,Barnes-Bailey,Wallis and Futuna,2021,770.28,461.83,3624883.46,56.08,3523086.05,11870570.88,2.02,54.81,9,15.38,87.21,2,41.51,306165.58,High,Fly name better suffer option food really.,His necessary some need beyond wish after shake.,1540.3,55.45
62204d5e,Brown-Mccullough,Belize,2022,2961.59,122.04,3311419.34,28.22,46443527.61,18990296.22,6.08,1.75,46,50.94,73.45,2,25.49,261621.13,High,Recognize section product practice low.,Simple line consumer meet sing.,1229.5,70.26
9116ebbc,"Jackson, Fields and Young",Luxembourg,2023,828.27,966.76,2583780.18,41.13,18951645.0,19486573.94,6.61,35.94,7,44.12,72.57,1,46.44,499596.73,Low,Answer somebody region attorney feeling much.,So entire page attention.,3454.39,45.22
00f91f43,"Scott, Smith and Allen",Grenada,2023,633.09,53.38,3424730.69,72.19,2481839.91,8609195.17,1.26,68.25,5,40.61,71.95,2,26.54,354759.15,Low,Environmental affect responsibility lose.,Wife federal perform oil property beyond.,1709.08,70.0
3145cc54,Vargas-Dougherty,Kenya,2018,870.97,257.1,4125797.44,46.83,22389577.12,10428302.1,5.71,21.23,31,13.26,83.4,1,13.81,229076.72,Low,Audience better charge discuss certainly.,Community science individual everything though certainly glass road.,638.02,64.68
8c92b607,Cox PLC,American Samoa,2022,2911.28,928.37,917729.18,50.07,33281028.26,18390355.38,2.55,86.26,16,68.77,93.58,1,40.55,317712.28,High,Word where successful all.,Student away including true outside.,4419.47,62.26
f22b5613,Meyer Ltd,French Guiana,2015,4008.68,810.49,301486.1,48.96,8344169.69,11577324.36,6.68,38.6,0,51.45,99.59,5,14.4,256893.27,Low,South laugh goal glass provide.,Yes want administration mission.,4313.55,5.04
81ee8988,"Summers, Bradshaw and Shaw",Tajikistan,2020,4420.89,689.93,932906.26,98.19,2814160.4,12851520.69,7.76,98.37,33,36.34,85.66,2,31.84,316811.79,Medium,Poor person explain put wind war management manager.,North green provide pay remember.,3260.68,92.98
60cdc23f,Davis-Johnson,Marshall Islands,2017,1779.06,851.91,707240.82,94.43,14634437.48,940288.45,8.38,97.49,24,98.71,88.34,1,37.96,169951.54,High,Including cold allow business kind good relationship.,Recently six hour require.,2445.27,32.92
9982b3ee,"Ritter, Smith and Gordon",Sudan,2022,3060.48,347.0,2743280.74,91.44,37824805.98,12614130.43,8.04,11.71,16,70.33,93.7,4,49.54,197783.53,High,Big do think way store.,Figure three plant reach listen.,1914.16,39.48
e1e814bc,Evans-Tucker,Tajikistan,2017,2917.6,576.02,1995734.16,83.64,31011475.96,4586142.66,5.21,76.29,3,30.72,90.88,4,19.76,231485.45,Low,Physical low next act.,Financial care policy hot.,3488.63,32.97
3516d2d2,"Arnold, Martinez and Vance",Falkland Islands (Malvinas),2016,4916.94,633.3,2769709.53,15.04,11032844.51,16133430.76,6.43,65.41,44,2.44,91.83,4,44.43,145881.4,High,Feel window actually bring.,Officer break test to sister.,3553.42,54.73
fbfbe6e3,Rose-Cole,Ireland,2017,3796.53,63.7,1283577.0,15.43,22703566.88,1629683.76,7.48,84.04,43,1.84,84.3,5,19.68,167263.57,High,Agent inside soon beyond hotel.,Several only second pick baby act.,3905.44,18.61
40244360,Pham-Cox,Tonga,2017,2621.76,78.33,426152.98,33.42,27184224.6,14662710.34,2.5,87.59,38,0.81,70.3,5,12.82,71167.34,Low,End yard room animal can.,Hotel wife four test stuff important buy size.,2744.29,17.64
2149d668,Parker Group,Cuba,2018,1036.22,961.48,3657560.68,42.17,47200778.46,4373995.73,9.56,37.4,45,16.83,82.4,1,49.01,300691.82,High,Bring why prevent Mr.,Bring watch language month we short.,1424.35,36.8
cfcc2244,Dixon Inc,Korea,2022,3122.26,848.46,3036319.32,46.02,11926298.64,6148416.96,5.28,81.06,10,17.25,99.03,1,16.92,271621.58,Medium,Wonder assume use church sound east.,For never hair letter which economy.,549.85,21.19
e1c566eb,Lopez-Castillo,Netherlands,2021,3530.03,245.72,1162119.35,41.76,36604900.38,2262453.51,5.82,68.89,49,79.09,77.56,1,15.15,317361.25,High,Heavy report fly although.,Significant you black.,2101.51,2.24
821812df,"Martinez, Tate and Cunningham",Austria,2018,2163.11,454.27,1703200.09,47.11,33569655.61,7594763.12,9.34,36.71,42,48.59,70.1,2,40.65,406547.95,Low,Sea bit special court letter success.,Network establish above finish.,2498.5,73.26
b68c2de4,"French, Thomas and Pearson",French Guiana,2017,2820.62,241.86,2275407.29,82.41,1701932.86,8460556.71,4.52,0.86,31,26.29,83.57,5,32.11,342803.21,Medium,Artist green rock left.,No her politics eat.,4505.96,10.86
d0773c76,Rose Inc,Turkmenistan,2015,1850.13,471.95,575691.65,94.35,36039886.6,5645255.01,4.68,21.14,8,36.59,95.92,1,16.19,425681.0,Low,Size house drop perform charge real.,Standard window may grow.,1206.96,96.97
d5c7f75b,Sanders Group,Hungary,2023,2012.0,326.1,1305987.36,52.83,6164974.15,8800696.41,9.77,17.97,49,50.72,70.48,3,13.47,493502.64,Low,Attack power give lawyer according room chance.,Religious protect apply guess take.,1253.66,9.6
8f1068bc,"Small, Banks and Bush",Cameroon,2015,4531.07,408.81,3879324.29,55.37,31449207.63,10693716.13,1.63,84.71,34,74.06,91.24,5,30.94,243928.72,Medium,Provide plant market past structure she especially.,Type amount alone PM treat focus player.,1009.88,74.51
5e5b183a,Lara-Nguyen,Burkina Faso,2020,4142.59,429.13,409553.6,80.61,25676158.42,14746151.54,7.32,18.28,24,39.27,80.96,2,38.5,118413.18,Medium,Mention simple source somebody business poor reflect.,Step method customer check best.,2478.14,65.33
b94f951a,Garcia-Nguyen,Central African Republic,2020,3982.1,64.58,617377.98,93.03,41144368.71,5008150.79,6.7,80.74,33,96.34,99.26,1,10.11,247822.49,High,But already rate suffer many order artist tree.,Spring away growth both author.,1771.73,32.71
